Casula Mall,"1 Ingham Dr, Casula NSW 2170, Australia",-33.948829,150.90027,,Evie Networks,2,4,50.065 kW,0,2,2,"52 Soldiers Parade, Edmondson Park NSW 2174, Australia",5.58,1.08,"89 Williamson Rd, Ingleburn NSW 2565, Australia",7.68,1.38,96,23/8/2022
Hungry Jack's Cabramatta,"401 Cabramatta Rd W, Cabramatta NSW 2166, Australia",-33.898778,150.919791,Open 24/7,Evie Networks,2,4,50.065 kW,0,2,2,"224 Railway Parade, Cabramatta, NSW, Australia, NSW 2166, Australia",1.85,0.21,"1 Ingham Dr, Casula NSW 2170, Australia",6.78,1.23,97,5/5/2022
Hyundai Head Office,"394 Lane Cove Rd, Macquarie Park NSW 2113, Australia",-33.78528,151.12685,,,1,2,50 kW,0,1,1,"22 Giffnock Ave, Macquarie Park NSW 2113, Aus, Macquarie Park 2113",0.48,0.11,"55-61 Talavera Road,, Macquarie Park, North Ryde, NSW, Australia, 2113",1.48,0.25,98,10/3/2023
bp pulse Ballina Travel Centre,"41 Bruxner Hwy, West Ballina NSW 2478, Australia",-28.86162625,153.5168241,"Open 24/7
24/7",bp pulse,1,2,75 kW,0,2,0,"95 Cherry Street, Ballina, NSW, 2478",6.02,1.07,"56 Bangalow Rd, Ballina NSW 2478, Australia",6.25,1.09,99,10/3/2023
HomeCo Castle Hill,"18 Victoria Avenue, Castle Hill NSW 2154, Australia",-33.727803,150.976049,"Car park opening hours Mon/Tue/Wed/Fri 9am - 6pm Thu 9am - 8:30pm Sat 9am -
5:30pm Sun 10am - 5:30pm",Evie Networks,2,4,50.065 kW,0,2,2,"3 Columbia Ct, Norwest NSW 2153, Australia",1.32,0.23,"98-100 Windsor Rd, Northmead NSW 2152, Australia",8.1,1.31,100,23/8/2022
Porsche Centre Willoughby,"445 Willoughby Rd, Willoughby NSW 2068, Australia",-33.810007,151.199649,Mon - Fri 8AM - 5PM Sat - Sun Closed,,2,2,22 - 350 kW,0,2,0,"61 Atchison St, Crows Nest NSW 2065, Australia",1.52,0.35,9 Eastern Valley Way (or 16 Harden Avenue) Northbridge NSW,1.62,0.38,101,10/3/2023
Porsche Newcastle,"34 Griffiths Rd, Lambton NSW 2299, Australia",-32.91361,151.723441,,,1,1,,0,1,0,"10 Rugby Rd, New Lambton, NSW, Australia, 2304",1.88,0.29,"59-61 Tudor St, Hamilton NSW 2303, Australia",3.52,0.56,102,10/3/2023
bp pulse Heatherbrae,"269 Pacific Hwy, Heatherbrae NSW 2324, Australia",-32.78331737,151.7370376,"Open 24/7
24/7",,1,2,75 kW,0,1,1,"7 Poynton Pl, Thornton NSW 2322, Australia",14.35,2.77,"2285 Pacific Hwy, Heatherbrae NSW 2324, Australia",1.2,0.19,103,10/3/2023
BP Wyoming (Coming Soon),"481 Pacific Hwy, Wyoming NSW 2250, Australia",-33.408131,151.350981,,,2,2,150 - 350 kW,0,2,0,"733 Pacific Hwy, Narara NSW 2250, Australia",2.95,0.69,"21cc Pacific Mwy, Alison NSW 2259, Australia",21.1,4.81,104,10/3/2023
Caltex Woolworths (Coming Soon),"9 Bay Village Rd, Bateau Bay NSW 2261, Australia",-33.373094,151.473563,,AmpCharge,5,5,335kW,0,5,0,"509 - 517 The Entrance Road, Long Jetty, NSW, Australia, 2261",0.75,0.1,"Cnr Mingara Dr & Wyong Rd, Tumbi Umbi NSW 2261",3.65,0.61,105,10/3/2023
Ampol Wentworthville (Coming Soon),"313 Great Western Highway South Wentworthville NSW 2145, Australia",-33.81631785,150.9716763,Open 24/7,AmpCharge,1,2,150kW,0,1,1,"50 Smith St, Wentworthville NSW 2145, Australia",1.6,0.3,"Darcy St &, Macquarie St, Parramatta NSW 2150, Australia",6.68,1.36,106,10/3/2023
bp pulse Penrith (Coming Soon),"2213 Castlereagh Rd, Penrith NSW 2750, Australia",-33.74356323,150.6923182,Open 24/7,Zero,1,2,75kW,0,2,0,"2140 Castlereagh Road Penrith NSW 2750, Australia",0.8,0.13,"221 Wolseley St, Jamisontown NSW 2750, Australia",4.12,0.72,107,10/3/2023
Shell Jamisontown,"221 Wolseley St, Jamisontown NSW 2750, Australia",-33.770295,150.673823,Open 24/7,Evie Networks,2,4,350 kW,0,2,2,"130a Batt Street, Penrith, NSW",2.48,0.42,"2213 Castlereagh Rd, Penrith NSW 2750, Australia",3.88,0.59,108,23/8/2022
BP Balgowlah,"485 Sydney Rd, Balgowlah NSW 2093, Australia",-33.79540882,151.2559649,Open 24/7,bp pulse,1,2,75 kW,0,2,0,"Stockland Balgowlah, 197-215 Condamine St, Balgowlah NSW 2093, Australia",1.72,0.31,"6 Myahgah Rd, Mosman NSW 2088, Australia",4.53,1.09,109,10/3/2023
Figtree Grove Shopping Centre (2),"Figtree Grove Shopping Centre, Figtree Grove Carpark, Figtree NSW 2525, Australia",-34.43779838,150.8634488,Open 24/7,Supercharger,6,6,250 kW,0,6,0,"19 Princes Hwy, Figtree NSW 2525, Australia",0.04,0.02,"Regent St, Wollongong NSW 2500, Australia",5.32,1.09,110,10/3/2023
BP Tumbi Umbi,"Cnr Mingara Dr & Wyong Rd, Tumbi Umbi NSW 2261",-33.36288685,151.4445016,Open 24/7,bp pulse,1,2,75 kW,0,1,1,"Mingara Dr opp Hansens Rd, Tumbi Umbi NSW 2261, Australia",0.4,0.1,"9 Bay Village Rd, Bateau Bay NSW 2261, Australia",4.15,0.75,111,10/3/2023
Ampol Woolworths MetroGo Northmead,"98-100 Windsor Rd, Northmead NSW 2152, Australia",-33.787777,150.994685,Open 24/7,AmpCharge,1,2,150 kW,0,1,1,"1 Eels Place, Parramatta NSW 2150",2.42,0.27,"Darcy St &, Macquarie St, Parramatta NSW 2150, Australia",7.4,1.62,112,5/5/2022
bp pulse Wiley Park,"24-42 King Georges Road, Wiley Park, NSW 2195",-33.91957312,151.0669475,"Open 24/7
24/7",,1,2,75 kW,0,1,1,"21 Roselands Ave, Roselands NSW 2196, Austral, Roselands 2196",2.5,0.5,"81 Wangee Rd, Lakemba NSW 2195, Australia",1.78,0.23,113,10/3/2023
BMW Sydney Rushcutters Bay,"65 Craigend St, Rushcutters Bay NSW 2010, Australia",-33.87725,151.227824,8:30am - 5:30pm weekdays 9am (Sat) 10am (Sun) - 5pm weekends,,2,4,50 kW,0,4,0,"203 Victoria St, Potts Point NSW 2011",0.85,0.34,"1 Bay St, Glebe NSW 2037, Australia",5.03,1.05,114,10/3/2023
Leichhardt Marketplace,"128 Flood Street, Leichhardt NSW 2040, Australia",-33.88518,151.148629,"Car park hours 6:30am - 10:30pm 7 days a week (May vary on public holidays) A
Land and Environment Court Order prohibits car park access outside of these
hours.",Evie Networks,2,4,50.065 kW,0,2,2,"41a/142 Addison Rd, Marrickville NSW 2204, Australia",3.22,0.55,"586A Parramatta Rd, Croydon NSW 2132, Australia",2.92,0.47,115,10/3/2023
bp pulse Macarthur,"2a Blaxland Rd, Campbelltown NSW 2560, Australia",-34.05317082,150.8236398,"Open 24/7
24/7",bp pulse,1,2,75 kW,0,2,0,"200 Gilchrist Dr, Campbelltown NSW 2560, Australia",3.85,0.77,"1 Art Gallery Rd, Campbelltown NSW 2560, Australia",3.58,0.64,116,10/3/2023
Porsche Centre Sydney South,"470 Gardeners Rd, Alexandria NSW 2015, Australia",-33.920826,151.194538,Weekdays 08:30 - 17:30,,2,2,22 - 350 kW,0,2,0,"154 O'Riordan St., Mascot, NSW, 2020",1.25,0.19,"34 Victoria Rd, Marrickville NSW 2204, Australia",2.95,0.47,117,10/3/2023
BP Asquith,"462 Pacific Hwy, Asquith NSW 2077, Australia",-33.68999427,151.1061347,Open 24/7,bp pulse,1,2,75 kW,0,2,0,"21 Station St, Thornleigh NSW 2120, Australia, Thornleigh 2120",6.82,1.29,200 Pennant Hills Rd Thornleigh NSW 2120,6.28,1.28,118,10/3/2023
Sydney Olympic Park,"9 Murray Rose Ave, Sydney Olympic Park NSW 2127, Australia",-33.84603863,151.0698039,Open 24/7,NRMA,1,2,50 kW,0,1,1,Pullman Sydney Olympic Park ,0.42,0.12,"2A Regatta Rd, Five Dock NSW 2046, Australia",6.35,1.21,119,5/5/2022
Westpac Parramatta Square,"Darcy St &, Macquarie St, Parramatta NSW 2150, Australia",-33.815581,151.004744,,Exploren,1,1,7 - 40 kW,0,1,0,"17 Wentworth St, Parramatta NSW 2150, Australia",1.95,0.4,"Fifth St, Parramatta NSW 2150",4.03,0.71,120,10/3/2023
Western Sydney University - Campbelltown Campus,"William Downes Avenue, Campbelltown NSW 2560 AU",-34.067758,150.788933,Open 24/7,,2,4,50 kW,0,3,1,"Lot 1 Mount Annan Dr, Mount Annan NSW 2567, Australia",3.2,0.65,"1 Art Gallery Rd, Campbelltown NSW 2560, Australia",2.48,0.35,122,5/5/2022
Parkes Swimming Pool,"27 Dalton St, Parkes NSW 2870, Australia",-33.1372177,148.1726205,Open 24/7,NRMA,1,2,50 kW,0,1,1,"14 Cross St, Forbes NSW 2871, Australia",33.3,8.45,"70 Currajong Street, Parkes NSW 2870, Australia",2.22,0.54,124,5/5/2022
Winbourne Rd Parking,"87 Winbourne Rd, Brookvale NSW 2100, Australia",-33.7620831,151.2725704,Open 24/7,JOLT,1,2,25kW,0,1,1,"485 Pittwater Rd, Brookvale NSW 2100, Australia",0.75,0.13,"485 Sydney Rd, Balgowlah NSW 2093, Australia",4.75,1.02,125,10/3/2023
West Tamworth League Club,"25 Park St, West Tamworth NSW 2340, Australia",-31.101649,150.917126,Open 24/7,Supercharger,4,4 (CCS/SAE compatible),120 kW,4,0,0,"52 Brisbane St, Tamworth NSW 2340, Australia",2.45,0.31,"2 Kable Ave, Tamworth NSW 2340, Australia",2.45,0.29,126,5/5/2022
Ashfield Mall,"260A Liverpool Road, Ashfield, NSW 2131",-33.8895619,151.1236298,"Open 24/7
6am - 11pm 7 days a week Coles close at 10pm so they close the carpark early.",Evie Networks,2,4,50.065 kW,0,2,2,"110 Brighton St, Croydon Park NSW 2133, Australia",1.7,0.31,"586A Parramatta Rd, Croydon NSW 2132, Australia",2.6,0.34,127,10/3/2023
Royal Randwick,"73 Belmore Road, Randwick NSW 2031, Australia",-33.915171,151.241129,"Parking open 6:00am - 10:00pm https://www.royalrandwick.com.au/centre-
info/parking",Evie Networks,2,4,50.065 kW,0,2,2,"49 St Pauls St, Randwick NSW 2031, Australia",0.68,0.1,"UNSW Mall Entrance, Anzac Pde, Kensington NSW 2052, Australia",2.5,0.27,128,5/5/2022
HomeCo Bankstown,"9-49 Chapel Road, Bankstown NSW 2200, Australia",-33.931975,151.030127,Open 24/7,Evie Networks,2,4,50.065 kW,0,2,2,"8 Greenfield Parade, Bankstown NSW 2200, Australia",2.05,0.37,"Milperra Rd, The River Rd, Revesby NSW 2212",1.48,0.3,129,5/5/2022
bp pulse Revesby,"Milperra Rd, The River Rd, Revesby NSW 2212",-33.93879088,151.0177757,Open 24/7,bp pulse,1,2,75.25kW,0,1,1,"8 Greenfield Parade, Bankstown NSW 2200, Australia",4.3,0.78,"9-49 Chapel Road, Bankstown NSW 2200, Australia",3.28,0.55,130,10/3/2023
Tesla Raymond Terrace (Coming Soon),"74 Benjamin Lee Dr, Raymond Terrace NSW 2324, Australia",-32.76104726,151.7751793,Open 24/7,Supercharger,15,15,250kW - 350kW,15,0,0,"6 Muir St, Medowie NSW 2318, Australia",13.25,2.61,"40 Richardson Rd, Raymond Terrace NSW 2324, Australia",1.62,0.28,131,10/3/2023
19/287 Victoria Rd Building,"19/287 Victoria Rd, Rydalmere NSW 2116, Austr, Rydalmere 2116",-33.812096,151.035754,,Exploren,6,6,60kW,0,6,0,"1 Eels Place, Parramatta NSW 2150",3.35,0.55,"Fifth St, Parramatta NSW 2150",1.42,0.21,132,10/3/2023
Western Sydney University - P16 Car Park,"Fifth St, Parramatta NSW 2150",-33.811239,151.023729,Open 24/7,,2,4,50kW,0,2,2,"1 Eels Place, Parramatta NSW 2150",3.15,0.53,"19/287 Victoria Rd, Rydalmere NSW 2116, Austr, Rydalmere 2116",2.8,0.52,133,5/5/2022
Spencer St & Regatta Rd Parking,"2A Regatta Rd, Five Dock NSW 2046, Australia",-33.869534,151.116173,Open 24/7,JOLT,1,2,25kW,0,1,1,49/53 Parramatta Rd Concord NSW 2137 AU,1.85,0.37,"586A Parramatta Rd, Croydon NSW 2132, Australia",2.58,0.44,134,5/5/2022
BP Ashfield,"586A Parramatta Rd, Croydon NSW 2132, Australia",-33.874062,151.126746,Open 24/7,Evie Networks,2,4,50.065 kW,0,2,2,49/53 Parramatta Rd Concord NSW 2137 AU,3.22,0.63,"2A Regatta Rd, Five Dock NSW 2046, Australia",1.48,0.25,135,10/3/2023
UNSW - School of Photovoltaic and Renewable Energy Engineering,"UNSW Mall Entrance, Anzac Pde, Kensington NSW 2052, Australia",-33.91799,151.226538,Open 24/7,ChargePoint,1,2,22 - 50 kW,0,1,1,"20 Oval Ln, Kensington NSW 2033, Australia",1.02,0.37,"73 Belmore Road, Randwick NSW 2031, Australia",2.15,0.58,136,10/3/2023
No 2 Sportsground,"Smith St, Newcastle West NSW 2302, Australia",-32.93036568,151.760711,Open 24/7,Chargefox,1,2,50 kW,0,1,1,"Wharf Rd & Merewether St, Newcastle NSW 2300, Australia",1.95,0.3,"59-61 Tudor St, Hamilton NSW 2303, Australia",1.82,0.29,137,5/5/2022
Ampol Hamilton (Coming Soon),"59-61 Tudor St, Hamilton NSW 2303, Australia",-32.92502001,151.7510204,Open 24/7,AmpCharge,2,4,335kW,0,3,1,"Smith St, Newcastle West NSW 2302, Australia",1.78,0.25,"Smith St, Newcastle West NSW 2302, Australia",1.78,0.25,138,10/3/2023
Hands of Fame Park,"2 Kable Ave, Tamworth NSW 2340, Australia",-31.090437,150.927465,Open 24/7,NRMA,1,2,50 kW,0,1,1,"52 Brisbane St, Tamworth NSW 2340, Australia",0.4,0.11,"25 Park St, West Tamworth NSW 2340, Australia",2.45,0.48,139,5/5/2022
Ampol Lakemba (Coming Soon),"81 Wangee Rd, Lakemba NSW 2195, Australia",-33.91158022,151.0733967,Open 24/7,AmpCharge,1,2,,0,1,1,"110 Brighton St, Croydon Park NSW 2133, Australia",4.08,0.76,"24-42 King Georges Road, Wiley Park, NSW 2195",1.27,0.26,140,10/3/2023
Macquarie Centre (2),"270 Talavera Rd, Macquarie Park NSW 2113, Australia",-33.776893,151.122247,Open 24/7,Evie Networks,2,4,50.065 kW,0,2,2,"63-71 Talavera Rd, Macquarie Park, New South Wales 2113, Australia",0.03,0.02,"55-61 Talavera Road,, Macquarie Park, North Ryde, NSW, Australia, 2113",1.88,0.43,141,5/5/2022
Northbridge Plaza,9 Eastern Valley Way (or 16 Harden Avenue) Northbridge NSW,-33.809326,151.208848,"Open 24/7
The designated spaces are chained up outside 0700 - 2200. However, one unit's
cables reach the space behind, and the other's cables reach the space beside.
Those other spaces are available 24/7.",Evie Networks,2,4,50.065 kW,0,2,2,"450 Miller St, Cammeray NSW 2062, Australia",2.35,0.53,"445 Willoughby Rd, Willoughby NSW 2068, Australia",1.23,0.15,142,23/8/2022
Wollongong Central - Regent St Entrance,"Regent St, Wollongong NSW 2500, Australia",-34.423975,150.892316,6:00AM - 12:00AM,Evie Networks,2,4,50.065 kW,0,2,2,"71 Market St, Wollongong NSW 2500, Australia",0.12,0.06,"17 Stewart St, Wollongong NSW 2500, Australia",1.35,0.15,143,10/3/2023
Stewart St East Car Park,"17 Stewart St, Wollongong NSW 2500, Australia",-34.428268,150.90015,Open 24/7,NRMA,2,4,75-175kW,0,2,2,"2-14 Cliff Rd, North Wollongong NSW 2500, Australia",1.65,0.35,"Regent St, Wollongong NSW 2500, Australia",1.35,0.34,144,5/5/2022
bp pulse Sydenham (Coming Soon),"339 Princes Hwy, St Peters NSW 2044, Australia",-33.91631873,151.1727898,,,1,2,75.25kW,0,2,0,"154 O'Riordan St., Mascot, NSW, 2020",2.4,0.38,"470 Gardeners Rd, Alexandria NSW 2015, Australia",2.28,0.35,145,10/3/2023
Marrickville Metro Shopping Centre,"34 Victoria Rd, Marrickville NSW 2204, Australia",-33.907982,151.170899,,Evie Networks,2,4,50.065 kW,0,2,2,"45 Edinburgh Rd, Marrickville NSW 2204, Australia",0.1,0.07,"470 Gardeners Rd, Alexandria NSW 2015, Australia",2.95,0.49,146,23/8/2022
Sovereign Place,"John Oxley Dr Before Chancellor Dr, Thrumster NSW 2444, Australia",-31.457966,152.827345,Open 24/7,NRMA,2,4,50 kW,0,2,2,"179 Gordon St, Port Macquarie, Australia, NSW 2444",8.02,1.64,"1063 Oxley Hwy, Thrumster NSW 2444, Australia",1.52,0.32,147,5/5/2022
Port Macquarie Service Centre,"1063 Oxley Hwy, Thrumster NSW 2444, Australia",-31.46395,152.821926,"Open 24/7
00:00 - 23:59",Chargefox,2,4,50 - 350 kW,0,2,2,"179 Gordon St, Port Macquarie, Australia, NSW 2444",8.72,1.83,"John Oxley Dr Before Chancellor Dr, Thrumster NSW 2444, Australia",1.08,0.14,148,5/5/2022
The Canopy Lane Cove (1),"2 Rosenthal Ave, Lane Cove NSW 2066, Australia",-33.813936,151.169298,"Carpark open 7 days, 6AM to 1AM",Evie Networks,2,4,50.065 kW,0,2,2,"2-24 Birdwood Lane, Lane Cove NSW 2066, Australia",1.3,0.21,"405 Pacific Hwy, Artarmon NSW 2064, Australia",2.05,0.49,150,5/5/2022
Mirvac South Eveleigh,"2 Central Ave, Eveleigh NSW 2015, Australia",-33.895823,151.196297,5am - 11:30pm,Chargefox,2,4,50 kW,0,2,2,"88 Broadway Hotel Entrance Via, 4 Central Park Ave, Chippendale NSW 2008, Australia",1.7,0.29,"133 Wyndham St Cnr Mcevoy St, Alexandria, NSW, 2015, Australia",1.08,0.15,151,5/5/2022
Ampol Woolworths MetroGo Alexandria,"133 Wyndham St Cnr Mcevoy St, Alexandria, NSW, 2015, Australia",-33.90214,151.20003,Open 24/7,AmpCharge,1,2,150 kW,0,1,1,"2 Central Ave, Eveleigh NSW 2015, Australia",0.92,0.18,"2 Central Ave, Eveleigh NSW 2015, Australia",0.92,0.18,152,23/8/2022
Western Sydney University - Kingswood Campus,"Second Avenue, Kingswood NSW 2747, Australia",-33.769905,150.729213,Open 24/7,,1,2,50kW,0,1,1,"82a O'Connell St, Kingswood NSW 2747, Australia",0.82,0.11,"2213 Castlereagh Rd, Penrith NSW 2750, Australia",6.85,1.1,153,5/5/2022
Raglan St West Car Park,"188 Raglan St, Mosman NSW 2088, Australia",-33.830986,151.243556,Open 24/7,Evie Networks,2,4,50.065 kW,0,2,2,"1 James Place, North Sydney NSW 2060, Australia",4.2,0.82,"6 Myahgah Rd, Mosman NSW 2088, Australia",1.05,0.23,154,10/3/2023
Mosman Civic,"6 Myahgah Rd, Mosman NSW 2088, Australia",-33.825551,151.241426,Open 24/7,Evie Networks,1,2,50 kW,0,1,1,"1 James Place, North Sydney NSW 2060, Australia",4.05,0.71,"188 Raglan St, Mosman NSW 2088, Australia",0.88,0.12,155,5/5/2022
Ocean St Parking,"5/16 Ocean St, Narrabeen NSW 2101, Australia",-33.71949606,151.2986274,Open 24/7,JOLT,1,2,25kW,0,1,1,"40 Kingsway, Dee Why NSW 2099, Australia",4.75,0.92,"9 Lagoon St, Narrabeen NSW 2101",0.9,0.14,156,10/3/2023
Lagoon St Carpark,"9 Lagoon St, Narrabeen NSW 2101",-33.7138449,151.2984042,Open 24/7,JOLT,1,2,25kW,0,1,1,"80-82 Mona Vale Road, Mona Vale NSW 2103, Australia",4.88,0.94,"5/16 Ocean St, Narrabeen NSW 2101, Australia",0.92,0.15,157,10/3/2023
Sylvania BMW Service and Parts Centre,"128 Parraweena Rd, Miranda NSW 2228",-34.02707437,151.1170471,Monday - Friday 7:30am - 5pm Sat & Sun Closed,,1,2,,0,2,0,"600 Kingsway, Mirandaâ€Ž NSWâ€Ž 2228, Australia",2.15,0.53,"Koonya Cct, Caringbah NSW 2229, Australia",0.9,0.16,158,10/3/2023
Bunnings Caringbah,"Koonya Cct, Caringbah NSW 2229, Australia",-34.02815,151.121855,6am - 9pm most days - check Bunnings hours,Exploren,1,2,50 kW,0,1,1,"600 Kingsway, Mirandaâ€Ž NSWâ€Ž 2228, Australia",2.88,0.66,"128 Parraweena Rd, Miranda NSW 2228",0.9,0.14,159,23/8/2022
Dan Murphy's Swansea,"36 Josephson St, Swansea NSW 2281, Australia",-33.08874886,151.6375876,Open 24/7,Evie Networks,2,4,50.065 kW,0,2,2,"228 Pacific Hwy, Swansea NSW 2281, Australia",0.48,0.11,"34 Griffiths Rd, Lambton NSW 2299, Australia",25.42,5.15,160,10/3/2023
Coles Tenterfield,"13 Crown St, Tenterfield NSW 2372, Australia",-29.05606654,152.0176587,Open 24/7,Supercharger,4,4,250 kW,0,4,0,"157 Manners St, Tenterfield NSW 2372, Australia",0.35,0.15,"265 Grey St, Glen Innes NSW 2370, Australia",91.8,24.9,161,10/3/2023
Audi Centre Sydney,"895 S Dowling St, Zetland NSW 2017, Australia",-33.907016,151.213019,Open 24/7,Chargefox,1,1,165 kW,0,1,0,"4 Defries Ave, Zetland NSW 2017, Australia",0.7,0.14,"2 Defries Ave, Zetland NSW 2017, Australia",0.18,0.08,162,5/5/2022
Mona Vale Library Car Park,"1 Park St, Mona Vale NSW 2103, Australia",-33.67606,151.303827,Open 24/7,JOLT,1,2,25kW,0,1,1,"80-82 Mona Vale Road, Mona Vale NSW 2103, Australia",1.27,0.38,"9 Lagoon St, Narrabeen NSW 2101",4.68,0.84,163,10/3/2023
Bathurst Visitor Information Centre (1),"1 Kendall Ave, Bathurst NSW 2795, Au",-33.41901,149.586756,Open 24/7,Supercharger,6,6 (CCS/SAE compatible),120 kW,6,0,0,"121 Howick St
Bathurst NSW 2795, Australia",0.52,0.14,"Orange Civic Centre Car Park, 151A Byng St, Orange NSW 2800, Australia",56.38,14.36,165,5/5/2022
Wilcannia Hospital,"1 - 7 Ross St, Wilcannia NSW 2836, Australia",-31.557629,143.386007,Open 24/7,NRMA,2,4,75 kW,0,2,2,"18 Tramway Terrace, Broken Hill NSW 2880",200.18,61.12,"Kintore Headframe Car Park, 51 Bromide St, Broken Hill, NSW 2880, Australia",197.6,60.56,166,5/5/2022
Broken Hill,"Kintore Headframe Car Park, 51 Bromide St, Broken Hill, NSW 2880, Australia",-31.959618,141.45957,Open 24/7,NRMA,1,2,50 kW,0,1,1,"18 Tramway Terrace, Broken Hill NSW 2880",2.15,0.33,"1 - 7 Ross St, Wilcannia NSW 2836, Australia",197.6,58.22,167,5/5/2022
Knockrow Supercharger,"419 Hinterland Way, Knockrow NSW 2479, Australia",-28.749539,153.534722,"Open 24/7
Charger 24/7 Business Monday - Sunday 9am - 4pm",Supercharger,6,6 (CCS/SAE compatible),120 kW,6,0,0,"1699 Pacific Highway Knockrow New South Wales 2479, Australia",0.05,0.02,"41 Bruxner Hwy, West Ballina NSW 2478, Australia",14.4,3.1,168,5/5/2022
The Farm Byron Bay,"11 Ewingsdale Rd, Ewingsdale NSW 2481, Australia",-28.636128,153.55346,Open 24/7,NRMA,2,4,50 kW,0,2,2,"91 Centennial Circuit, Byron Bay NSW 2481, Australia",3.7,0.55,1 Porter Street Byron Bay NSW 2481 AU,4.32,0.66,169,5/5/2022
Byron Bay Library,"28 Lawson Street, Byron Bay NSW 2481, Australia",-28.643274,153.615874,"Open 24/7
Strict 30 minute time limit to allow others to use the charger. Byron Shire
Council does ticket vehicles who overstay.",Chargefox,1,2,50 kW,0,1,1,"20 Bay St, Byron Bay NSW 2481, Australia",0.4,0.11,1 Porter Street Byron Bay NSW 2481 AU,4.1,0.64,170,5/5/2022
Elements of Byron Bay Car Park,"144 Bayshore Dr, Byron Bay NSW 2481",-28.626456,153.58658,Open 24/7,Chargefox,1,2,50 kW,0,1,1,1 Porter Street Byron Bay NSW 2481 AU,0.78,0.14,1 Porter Street Byron Bay NSW 2481 AU,0.78,0.14,171,5/5/2022
Dubbo Supercharger,"76 Wingewarra Street, Dubbo, Australia, 2830",-32.2497658,148.6101332,Open 24/7,Supercharger,4,4 (CCS/SAE compatible),120 kW,4,0,0,,,,,,,,5/5/2022
Port Macquarie Supercharger,"10 Winery Drive, Port Macquarie, Australia, 2444",-31.4179402,152.8253421,Open 24/7,Supercharger,6,6 (CCS/SAE compatible),120 kW,6,0,0,,,,,,,,5/5/2022
Narooma Supercharger,"183 Princes Highway, Narooma, Australia, ",-36.2593414,150.1301376,,Supercharger,4,4 (CCS/SAE compatible),120 kW,4,0,0,,,,,,,,5/5/2022
Brewarrina Visitor Information & Exhibition Centre (Coming Soon),"Car park, Visitors Information Centre, 50 Bathurst Street, Brewarrina, NSW 2839",-29.96022661,146.8579639,Open 24/7,NRMA,2,4,75kW,0,2,2,,,,,,,,5/5/2022
Tenterfield Visitors Information Centre,"157 Rouse Street, Tenterfield",-29.058428,152.0182734,Open 24/7,NRMA,1,2,50 kW,0,1,1,,,,,,,,5/5/2022
Caltex Macksville,"Caltex Macksville, 22 Cooper St, Macksville 2447",-30.70973736,152.9198429,Open 24/7,Evie Networks,2,4,350 kW,0,2,2,,,,,,,,5/5/2022
Caddens Corner,"82a O'Connell St, Kingswood NSW 2747, Australia",-33.7687302,150.734742,Open 24/7,Evie Networks,1,2,22.016 - 50 kW,0,1,1,,,,,,,,5/5/2022
Innovation Campus - SBRC Building 237,"160 Innovation Way, North Wollongong NSW 2500, Australia",-34.4038181,150.8977853,Open 24/7,,1,2,50 kW,0,1,1,,,,,,,,5/5/2022
Ampol Seven Hills,"38 Abbott Rd, Seven Hills 2147, Australia",-33.7679303,150.943623,Open 24/7,Evie Networks,2,4,350 kW,0,2,2,,,,,,,,5/5/2022
Ampol Alexandria (Coming Soon),"133 McEvoy St, Alexandria NSW 2015, Australia",-33.9020829,151.1988168,,AmpCharge,1,2,150 kW,0,1,1,,,,,,,,5/5/2022
East Village Shopping Centre,"4 Defries Ave, Zetland NSW 2017, Australia",-33.9055882,151.2130576,"Daily, 6:00am - Midnight","Chargefox,",2,4,22 - 350 kW,0,3,1,,,,,,,,5/5/2022
Mulwala Water Ski Club (Coming Soon),"156 Melbourne St, Muwlala NSW 2647",-35.99477015,146.001637,"Open 24/7
9:30am to 11:00pm",Chargebay,2,4,kW,0,3,1,,,,,,,,1/7/2023
Dan Murphy's Batemans Bay,"51/53A Orient St, Batemans Bay NSW 2536, Australia",-35.709928,150.177723,,Evie Networks,1,2,50.116 kW,0,2,0,,,,,,,,1/7/2023
KFC Goulburn Sth (Coming Soon),"183 Hume St, Goulburn NSW 2580, Australia",-34.77213604,149.6927194,,,1,2,kW,0,2,0,,,,,,,,1/7/2023
Middy's Wagga Wagga East (Coming Soon),"176 Hammond Ave (Cnr, Stuart Rd, East Wagga Wagga NSW 2650, Australia",-35.1237268,147.398997,"Open 24/7
Weekdays: 7am - 5pm Saturdays: 8am - 12pm",Everty,1,2,kW,0,1,1,,,,,,,,1/7/2023
Wagga Wagga Cross St Car Park,"8/24 Cross St, Wagga Wagga, NSW 2650",-35.108358,147.37355,Open 24/7,NRMA,1,2,50 kW,0,1,1,,,,,,,,1/7/2023
NRMA Mudgee Short Street (Coming Soon),"Public Carpark, 47 Short Street, Mudgee NSW 2850",-32.5897926,149.5856993,Open 24/7,NRMA,2,4,kW,0,3,1,,,,,,,,1/7/2023
Orange (Coming Soon),"260 Peisley St, Orange NSW 2800, Australia",-33.2803485,149.1045578,,,6,6,250kW - 350kW,0,6,0,,,,,,,,1/7/2023
Oliver's Gundagai (2),"31 Annie Pyers Dr, Gundagai NSW 2722, Australia",-35.002013,148.109889,Open 24/7,Supercharger,6,6 (CCS/SAE compatible),120 kW,6,0,0,,,,,,,,1/7/2023
NRMA Charger Parkes,"Carpark of Parkes Swimming Pool, 27-29 Dalton St, Parkes NSW 2870, Australia",-33.13717696,148.1726352,,,1,2,50kW,0,1,1,,,,,,,,1/7/2023
Lake Macquarie Visitor Information Centre,"228 Pacific Hwy, Swansea NSW 2281, Australia",-33.091852,151.637364,Open 24/7,Everty,1,2,25 kW,0,1,1,,,,,,,,1/7/2023
Soldiers Point Marina,"2 Sunset Blvd, Soldiers Point NSW 2317, Australia",-32.701437,152.062622,,Chargefox,1,2,24 kW,0,1,1,,,,,,,,1/7/2023
Lake Haven Shopping Centre,"Cnr Lake Haven Dr, Lake Haven NSW 2263, Australia",-33.24019102,151.5037613,,Chargefox,1,2,120kW,0,2,0,,,,,,,,1/7/2023
Toronto Commercial Centre Carpark,"7 Pemell St, Toronto NSW 2283, Australia",-33.01436532,151.5957632,,Exploren,1,2,40 kW,0,2,0,,,,,,,,1/7/2023
Ampol Woolworths MetroGo Dural  (Coming Soon),"921 Old Northern Rd, Dural NSW 2158, Australia",-33.68299243,151.0285427,Open 24/7,AmpCharge,1,2,150kW,0,1,1,,,,,,,,1/7/2023
Hope St Parking Lot,"126 Hope St, Blaxland NSW 2774, Australia",-33.7451971,150.6103969,Open 24/7,Supercharger,6,6,250 kW,0,6,0,,,,,,,,1/7/2023
Ampol Woolworths MetroGo Charlestown (Coming Soon),"81 Pacific Hwy, Charlestown NSW 2290, Australia",-32.9672677,151.6954208,Open 24/7,AmpCharge,1,2,150kW,0,1,1,,,,,,,,1/7/2023
Ampol Woolworths MetroGo St Ives (Coming Soon),"164 Mona Vale Rd, St Ives NSW 2075, Australia",-33.7306437,151.1571089,Open 24/7,AmpCharge,1,2,150kW,0,1,1,,,,,,,,1/7/2023
Sungrow Power Australia Warehouse,"91 Victoria St, Smithfield NSW 2164, Australia",-33.8511379,150.934316,9am - 5:30,Everty,1,1,30kW,0,1,0,,,,,,,,1/7/2023
AmpControl,"726 Tomago Rd, Tomago NSW 2322, Australia",-32.82289869,151.7031403,Monday - Friday office hours,,2,4,75 kW,0,2,2,,,,,,,,1/7/2023
Darley St Parking,"10 Darley St, Forestville NSW 2087, Australia",-33.762097,151.214184,Open 24/7,JOLT,1,2,25 kW,0,1,1,,,,,,,,1/7/2023
Concord Land Rover (Coming Soon),49/53 Parramatta Rd Concord NSW 2137 AU,-33.868289,151.10386,,,1,1,25 kW,0,1,0,,,,,,,,1/7/2023
Greenway Wetherill Park,1183-1187 The Horsley Drive Wetherill Park NSW 2164 AU,-33.85040311,150.8984016,,Chargefox,1,2,120kW,0,2,0,,,,,,,,1/7/2023
Red Rooster Guildford,"322 Woodville Road Guildford, NSW 2161, Australia",-33.8521028,150.9955836,Open 24/7,Evie Networks,2,4,50.065 kW,0,2,2,,,,,,,,1/7/2023
BP Ingleburn,"89 Williamson Road, MacDonald Rd, Ingleburn NSW 2565, Australia",-33.98873226,150.8592698,Open 24/7,bp pulse Australia,2,4,75.25 kW,0,4,0,,,,,,,,1/7/2023
Ampol Foodary Marsden Park (Coming Soon),"875 Richmond Rd, Marsden Park NSW 2765, Australia",-33.71606446,150.8443544,Open 24/7,AmpCharge,1,2,150kW,0,1,1,,,,,,,,1/7/2023
